,English,Japanese,good_trans,original_language
26605,i hit you like what you sayin',私はあなたが言うことのようにあなたを殴りました,0,0
21939,its eye's right there.,その目はそこにあります。,0,0
25994,"i mean, anywhere at all, that's what's so incredibly great about helicopters.",つまり、どこにいても、それがヘリコプターの素晴らしいところです。,0,0
35980,"in order for me to exist in this world, i need him to keep wishing.",私がこの世界に存在するためには、彼に願い続けてもらう必要があります。,0,0
48255,Eventually they get into each other's bodies. What happens to him then?,やがて お互いの体に入り込む。 すると どうなるか?,0,1
14060,"hasegawasan, i caught a nice shikao suga.",長谷川さん いいスガシカオが 手に入った。,1,1
54846,What?,何だよ?,0,1
32393,"what do you do, konachan?",コナちゃん、どうする？,0,0
33348,"and supplies that are produced all over the world, literally",文字通り世界中で生産されている物資,0,0
49376,Here it is,さあ ここだよ,0,1
3327,"and if you didn't speak korean, that's what you were watching.",韓国語が分からなければ 他に選択肢はありませんから,1,1
1316,what are we going to do? it won't even be funny if we get lost too!,どうすんだよ 俺達も遭難したら シャレになんねえぞ!,1,1
58285,Inspected 37 enthusiastic people,熱愛中の37人を検査しました,0,1
8882,[ chuckles ] i couldn't agree more.,確かに,1,1
3092,you mean the harem that just figured out they're a harem?,ハーレムだって考えてるのね? ハーレムだわね ええそういうこと,1,1
5663,"smarter than us, certainly.",少なくとも俺達より,1,1
35180,"and you haven't gotten me that, have you?",そして、あなたは私にそれを取得していませんね？,0,0
26815,it should be all right as long as someone on the staff is supervising.,スタッフの誰かが監督している限り、それは大丈夫なはずです。,0,0
45270,that if an adult woman is doing now?,《もしや 今のが 大人の女のすることだと?》,0,1
47313,Consider escaping to Adminville,アドミンビルへの 脱出も考慮しよう,0,1
5960,since 1990,1990年から 私たちは,1,1
22617,understand each other's feelings,お互いの気持ちを理解する,0,0
47816,Shopping for Allison?,アリソンへのお買い物?,0,1
46257,The true purpose of the visitor is known when they reveal themselves,ビジターの真の目的は 奴等が正体を現す時に分かります,0,1
58395,What the hell is that! Choi Chuni,なんの話だよ!チェ・チュニって一体・・・,0,1
30824,bar the door.,ドアを閉めなさい。,0,0
24588,can you tell us about mikuriya?,みくりやについて教えてください。,0,0
32981,there are still those in the seven kingdoms who call me usurper.,私を皇位簒と呼ぶ7つの王国の人々がまだいます。,0,0
8175,use your core!,あなたのコアを使用してください!,1,1
40819,I thought I needed it,必要があると思い立ちました,0,1
54290,So is he the perpetrator?,つまり彼は加害者の方か?,0,1
28917,no way!,ありえない！,0,0
17695,thank you. i spent a lot of money on this shit.,どうも 大金をはたいたんだ,1,1
37260,which refers not only to the rats,これはラットだけではありません,0,0
52294,It became a very useful tool for political struggle.,政治闘争のとても便利な道具になったのです,0,1
5465,try it some time.,言うんだ,1,1
47428,Please call me that flower.,あの 花って呼んで下さい。,0,1
52691,The situation of the murder is all consistent with other cases,殺害の状況は すべて他の事件と一致してる,0,1
19658,where is this place?,ここはどこ?,1,1
39581,saying such things as,そのようなことを言う,0,0
46351,I was there too,私もそこにいたの,0,1
17013,"ah, i wanted to eat this.",これ 食べたかったんだ。,1,1
24849,excuse me?,すみません？,0,0
34120,that's the only thing i remember.,それが私が覚えている唯一のことです。,0,0
49496,But I don't think it's right,でも やっぱりそれが正しいとは思えません,0,1
26056,the handling of copyright directly impacts your life.,著作権の取り扱いはあなたの人生に直接影響を与えます。,0,0
36465,"oh, my did you finish your errands?",ああ、私のあなたはあなたの用事を終えましたか？,0,0
24984,"the employees who are proud to be working, why don't you recognize them?!",仕事に誇りを持っている社員の皆さん、気づいてみませんか？,0,0
21247,the super 8 camera that my grandfather got me sitting in that room,祖父が私をその部屋に座らせたスーパー8カメラ,0,0
32932,y'all happy?,みんな幸せ？,0,0
687,"and i said, well, i've taught graduate",私は「教えていますよ,1,1
44431,What is the purpose of killing Nadia?,ナディアを殺す目的は?,0,1
8415,sprinting down the pitch,華麗にゴールを決める,1,1
4673,or being a fake real:,fake realは,1,1
42450,"She said, Yes, but I'm here for this kid.",彼女は「ええ でもこの子のために私はここにいるの」と言いました,0,1
51811,Is it a trickster?,トリックスターをか?,0,1
56845,Looking back at what you have been given,自らが授かったものを 見つめ直すこと,0,1
54743,The suit is also made of energy,そのスーツも エネルギーで出来ている,0,1
38682,"that our father had two daughters. that he worked diligently, and",私たちの父には2人の娘がいました。彼が勤勉に働いたこと、そして,0,0
29798,there are.,がある。,0,0
18881,"i mean, not like that.",あんな大きいのはな,1,1
48962,Will concentrate on test preparation only,テスト対策のみに専念するでしょう,0,1
23509,al worried about thinking that we will quit shinchan because of us.,私たちのせいでしんちゃんを辞めるのではないかと心配していました。,0,0
37048,color bird. what does that mean?,色の鳥。どういう意味ですか？,0,0
1986,"the bad thing about you, is that you are all selfish!",あなたの悪いところは 利己的であるというところです,1,1
14302,"so, here you can see her moving her eyes around, moving her mouth around.",彼女が目や口を動かしている写真が並んでいます,1,1
9141,this is it. the beach house.,・ここだよ ここ ビーチハウス,1,1
42149,"Hey, are you hungry?",ねえ おなか すかない?,0,1
22100,we'll find them all soon enough.,それらはすべてすぐに見つかります。,0,0
14816,why do you think i rushed this contract?,何でこの契約を急いだと思う?,1,1
24970,"but why? well, transparency is scary",しかし、なぜ？まあ、透明度は怖いです,0,0
44618,There is a place for defecation during estrus.,発情期には排便の場所があるのです,0,1
32785,i actually have a date.,私は実際に日付を持っています。,0,0
8126,for abducting and molesting an eight year old boy on stanton.,誘拐やわいせつ行為で スタントンの8歳の少年,1,1
44379,This is private land,ここは私有地だが,0,1
5389,"conan, you have some too!",コナン君 あれ!,1,1
26674,we help build a resistance. we recruit.,私たちは抵抗を構築するのに役立ちます。募集します。,0,0
36289,"because whatever they have done to that guy over there, has removed any shred of humanity.",彼らが向こうのあの男にしたことは何でも、人類の断片を取り除いたからです。,0,0
42930,When this card is activated,このカードが発動したとき,0,1
7128,and then kill us anyway.,そしてオレたちも殺すさ,1,1
58632,It's not for the country that my son gave his life,息子が命を捧げたのは国の為では無い,0,1
23634,three parts mebendazole.,3つの部分のメベンダゾール。,0,0
29080,"you guys, go ahead. i'm gonna lay down some cover fire.",皆さん、どうぞ。カバーファイアを置くつもりです。,0,0
2922,the deep ocean is also gaining heat at a smaller rate,深海部では上部よりは緩やかに上昇していました,1,1
52330,Captain Cordero Ritter and Morgan,コルデロ大尉 リッターとモーガンだ,0,1
39980,"how's the shoulder, man?",肩はどう？,0,0
6542,life is not always as it seems.,人生とは、常に驚くべきものー,1,1
9954,a man is dead because of that.,その為に一人死んだ,1,1
25132,every last one?,最後の1つ？,0,0
55887,It's such an action that seems frustrating.,イライラしているよう見える そんな行動です,0,1
7800,no holding back.,ためらわない,1,1
7167,sinners!,罪人よ!,1,1
8276,"all these years, crowley has been riding me about obeying the rules and she's the one breaking protocol.",悪役じゃない 今は - 分かってる! まだ ムカつくわ 助けるなんて,1,1
20027,"alright, everyone ready? the words are wrong again.",よし、みんな準備はいい？言葉はまた間違っています。,0,0
2157,jirousan. can you help me look for niichan for the time being?,次郎さん すぐさ 兄ちゃんのこと探してもらえませんか,1,1
10170,it's true yebul is very jealous and unstable,それは本当よ エーブルは とても嫉妬深くて不安定で,1,1
4939,some profanity,使われているのも見受けられます,1,1
50817,Exaggerated,大げさだな,0,1
17847,wwhatever this is.,それが何であれ,1,1
59015,"He said, That was exactly what he wanted.",こう言ったんです それは正に彼が望んでた事だったと,0,1
59950,The goal is the Supreme Court,目標は最高裁判所よ,0,1
3277,but there's a way you can save me,でも お姉ちゃんなら 僕を助けることができる,1,1
3678,goku has won!,〈地球には平和が戻った。,1,1
56492,Warn Eli,イーライに警告を,0,1
37789,"why, your majesty? your countrymen are in danger",なぜ、あなたの威厳？あなたの同胞は危険にさらされています,0,0
11119,oh! a commercial!,CMですね それでは森田さんも,1,1
23335,is the ramen cooled?,ラーメンは冷やされていますか？,0,0
49230,And I heard high-pitched sounds and HYU2 sounds,そして甲高い音やヒューヒューと言う音を聞いていました,0,1
41039,Saying that you are not the real you now,今のあなたが 本当のあなたじゃないと言って,0,1
54742,Or is it more shocking to be abandoned by Nam Gyuman?,それともナム・ギュマンに見放されたことの方がショックかな,0,1
8287,"if you don't like it, leave.",嫌なら 去れ。,1,1
12311,take him down to earth.,彼を地球へ,1,1
57004,What is the relationship between our court and witnesses?,当法廷と 証人との関係は?,0,1
31086,"yeah, miles offered his loyalty in exchange for the money.",ええ、マイルはお金と引き換えに彼の忠誠を提供しました。,0,0
52111,I'm wondering how much I can save the lives of hungry humans!,飢えた人間の命を どんだけ救えると思ってんだよ!,0,1
3595,"with hundreds of hours of five drafts, six drafts",何百時間もかけて第5稿 第6稿まで作り,1,1
3621,i'm terribly sorry for getting you involved.,こんなことに巻き込んで ホントにごめんなさい,1,1
52079,Show where to go,どこへ行くかを示す,0,1
12710,"um actually, this spring",あの 実は この春,1,1
34203,"now, the world is shrouded in darkness.",今、世界は暗闇に包まれています。,0,0
26910,we're going to meet the savior.,私たちは救い主に会うつもりです。,0,0
13923,is he making a face? is that,彼のこの顔、何?,1,1
14900,crowning glory.,いけるか?,1,1
45572,Airi-chan. Is this device the source of the sound?,愛理ちゃん。 ピーガガガって音の 発信源は この装置なの?,0,1
43763,What the hell is that,一体何なのだろう,0,1
23834,but the religious world doesn't think that way.,しかし、宗教界はそのように考えていません。,0,0
24125,"i'm not your brother, but",私はあなたの兄弟ではありませんが,0,0
1224,"yes, yes.",それは結構,1,1
454,what's this?,ふざけんな この野郎!,1,1
31884,you got a gun? where is your gun?,あなたは銃を持っていますか？あなたの銃はどこにありますか？,0,0
3805,"i said, what kind of salts of potassium do you have? you know.",それでどんなカリウム塩があるか聞いたら,1,1
48688,this. I think you know.,これ。 分かってると思うけど。,0,1
15242,go. turn around.,向こうを向け,1,1
39551,"have higher degree, and are more central",程度が高く、より中心的です,0,0
42183,Sends super electromagnetic waves to the hit object ｡,打ちつけた対象物に 超電磁波を送り,0,1
24587,"ah, this always scares me.",ああ、これはいつも私を怖がらせます。,0,0
34063,i want to sleep without working.,働かずに寝たい。,0,0
16073,"kakashi, you are to report to the village for details from your last mission.",カカシさんは 報告のため 里に戻るようにとのことです。,1,1
51687,I'll get it,手に入れてやる,0,1
56044,You are the reason I trust,君こそ 私が信頼する理由だ,0,1
36039,"okay. that's it, gang!",わかった。それだけです、ギャング！,0,0
11177,"okay, thanks! i'll be waiting!",うん ありがとう 私 待ってる。,1,1
16931,"yes, yes, very kind.",ええ どうも親切に,1,1
7395,and that's when he was embarrassed in front of the public.,凶器のトロフィーが 手前に置かれていた》,1,1
32497,the body count is 10 percent higher.,体の数は10パーセント多いです。,0,0
55977,Completion of this super-gorgeous special flight,当当 超豪华特制便当 完成,0,1
57270,I also fast.,僕も断食します。,0,1
42031,That's the worst,そうょ もラ最悪よ,0,1
2543,"by her, you mean",此刻解放所有一切,1,1
36730,"now, my work began at the beginning.",今、私の仕事は最初から始まりました。,0,0
51695,I've broken their weapons and traps.,奴らの武器と罠を、壊してきたんだ。,0,1
2849,commonly known as zebra. where its being distributed is a topic of discussion,通称ゼブラと呼ばれ 闇ルートの連中たちの間でも,1,1
40621,I brought this venison,これを持ってきたわ 鹿の肉よ,0,1
35333,that unhappy one should be crazy.,その不幸な人は狂っているはずです。,0,0
33767,mother! what?,母親！何？,0,0
10373,where is it?,女の子の私を蹴飛ばしていた?!,1,1
51477,You should be happy to work with me,私と一緒に仕事が出来て 嬉しいはずよ,0,1
42914,"For those who are expanding their hearts and learning, this is what they mean",自分達の心や学ぶ事を広げて行く人達にとって、こういうのって,0,1
52296,Gaya's influential power and ability,我也在力所能及的范围内进行了接触,0,1
15745,"secondly, inflation simply never became a threat.",第二にインフレが脅威とならない事です,1,1
11483,"in a gothic cathedral, this kind of music is perfect.",ゴシック式大聖堂にはこういう音楽が合います,1,1
5827,"and a great humanitarian, mr. terry cox.",偉大な人道主義者 テリー・コックスだ,1,1
20773,they never got to see what i became.,彼らは私がどうなるかを決して見ることができませんでした。,0,0
43703,"Excuse me, I felt that I should play because of the setting of the stage",失礼 舞台という設定上、芝居をすべきだと感じまして,0,1
56717,Music can be said to exist in time,音楽は時間の中に存在するといえます,0,1
42603,Bamba Bambang Burn,バンバ バンバン バーン,0,1
53258,Well everyone this is,さて 皆さんはこれが,0,1
42449,Everything that should be disposed of after his death,彼の死後に全て 処分されるはずの物さ,0,1
11537,it doesn't work.,これでは意味がないのです,1,1
18006,we'll meet at the designated place!,集合場所で 会いましょう。 ラジャ~!,1,1
57513,How did you find out?,どうして分かったの?,0,1
33759,if there were ever anything that might be of therapeutic value to others,他の人にとって治療的価値があるかもしれない何かがあったら,0,0
9502,"right. limo back to the real world after the perfect date, huh?",リムジンで 現実世界へ戻すのね,1,1
17558,this is an olympic gold medal.,これはオリンピックの 金メダルだ,1,1
38061,its title the palace at four in the morning,そのタイトルは朝の4時に宮殿です,0,0
21797,"no, thanks.",結構です。,0,0
13465,they're sleeping well,いっぱい遊んで おなかいっぱい食べたから,1,1
19526,"let's never come here again, 'cause it would never be as much fun.",今はいいけど 今度日本に来ても 楽しくないかもね,1,1
1830,hey! you're hitting me!,こら! お前のパンチが 当たってるんだよ!,1,1
38140,i'm used to it. what does that mean?,慣れてる。どういう意味ですか？,0,0
24504,and if you want to get more specific,より具体的にしたい場合,0,0
52197,No! The movement is fast and the goal is too small !!,ダメです! 動きが速いし 目標が小さすぎます!!,0,1
49855,It's a big cock,巨根 だ,0,1
25102,i'll be in touch.,連絡します。,0,0
43775,Together,ともに力を合わせて,0,1
32345,"genius, kid.",天才、子供。,0,0
12059,ed stayed at a friend's most nights till she calmed down.,エドはたまらず友人宅へ そしたらソフィアは落ち着いた,1,1
8988,how is the trip?,旅はどう?,1,1
8980,lost my wife car accident. 18 months before all this.,妻は交通事故で死んだ こうなる18ヶ月前だ,1,1
39380,"what did you say, you bastard!",あなたは何と言いましたか、あなたはろくでなしです！,0,0
21220,both of you.,二人とも。,0,0
38417,"hannibal, hannibal, hannibal.",ハンニバル、ハンニバル、ハンニバル。,0,0
59426,"That's amazing, isn't it?",そりゃ すげえよ なあ?,0,1
53838,Now you said,今 君の言った,0,1
39622,why am i not surprised?,なぜ私は驚かないのですか？,0,0
10222,"you be it. come on, kids.",ライアンの鬼!,1,1
26676,"one day, it just suddenly seemed like a giant farce.",ある日、突然巨大な茶番劇のように見えた。,0,0
51939,Look at it soon,早く、ほら見ろ,0,1
43364,The child born cannot be happy,生まれてくる子も幸せになれない,0,1
54797,The ostensibly is to eradicate crime,表向きは犯罪撲滅を 掲げる事だ,0,1
57238,Did you allow driving?,運転を許可したろ?,0,1
9109,i would experience what it was to be unequal.,私は「平等でない」という経験をしました,1,1
18193,my foolish little brother,思いっきり はずしたな。 ごめん 兄さん。,1,1
24674,he says he's a reporter.,彼は彼がレポーターだと言います。,0,0
33274,yes.,はい。,0,0
8090,her body's turning on itself.,もちろん,1,1
56130,Mr. Sugada is strong,菅田君 強いな,0,1
38026,"they're learning our culture, our language, our heritage",彼らは私たちの文化、言語、遺産を学んでいます,0,0
6254,would you simply accept your new life and continue on?,新しい人生を受け入れ 生まれ変わるか?,1,1
2940,was that a woman on the phone? yeah.,さっきの電話 あれ 女か? はい。,1,1
2883,he only needed two stitches.,おでこ2針 縫っただけじゃない 立派な傷害です,1,1
30312,do you have a camera angle from the direction they're heading?,彼らが向かっている方向からのカメラアングルはありますか？,0,0
29449,hanna? he didn't.,ハンナ？彼はしませんでした。,0,0
23715,you know what i was wondering this morning?,あなたは私が今朝何を思っていたのか知​​っていますか？,0,0
43718,Someone get me out of here!,誰かここから出してくれ!,0,1
59776,amazing.,すごいね。,0,1
51853,Hector's complexion has returned to normal,ヘクトルの顔色も 元に戻った,0,1
59142,"I mean, Clove, no, the people in the current platoon",なんていうか チョウジや いのや 今の小隊の連中や。,0,1
22532,i'm trying.,私はしようとしています。,0,0
28276,oh,おお,0,0
33910,we do this by shooting a laser up into the atmosphere,これを行うには、大気中にレーザーを発射します,0,0
20233,what now?,今何？,0,0
56860,Blessing is enough,祝福だけで十分です,0,1
20241,"if it were me, i would want that person to be always close to me",もしそれが私なら、その人はいつも私の近くにいて欲しいです,0,0
12434,yeah. i remember. kind of.,あぁ、覚えている だいたいだけど,1,1
55800,I'm different from my dad,僕は パパとは違うから,0,1
50520,Are you ready?,覚悟はいいかな?,0,1
23239,to keep on giving,与え続けるために,0,0
25127,"administer ceftriaxone for one more day. as for anticonvulsant, prescribe levetiracetam 500 ml twice daily.",セフトリアキソンをもう1日投与します。抗けいれん薬については、レベチラセタム500mlを1日2回処方してください。,0,0
43108,Finch!,フィンチ!,0,1
58142,I'll give you the current fluke.,今のまぐれ当たりは くれてやる。,0,1
652,silence is in some way heroic?,沈黙が誰かのためになると?,1,1
41686,Oh cute,あら 可愛い,0,1
39371,love is stronger than death? what a load of rubbish,愛は死よりも強いのですか？なんてゴミだらけ,0,0
9826,"and it turns out, the best way to cut things in half",結果的に物を半分に切るのに最良の方法は,1,1
58746,No one saw him.,誰も彼を見なかった。,0,1
3184,"yeah, djs. deaf jews.",djうん、聴覚障害のユダヤ人。,1,1
37015,all the assistants are waiting around.,すべてのアシスタントが待っています。,0,0
9625,what's he saying?,内容は?,1,1
1944,i know what this is all about.,何でことだ,1,1
30358,because the fda amendment act only asks that you publish the trials conducted after 2008,fda改正法は、2008年以降に実施された試験の公開のみを求めているためです。,0,0
17797,"how a bill becomes a law, yes",などを知っていたり,1,1
29872,"usagisan, how did you do on your test?",うさぎさん、テストはどうでしたか？,0,0
14858,everything we have on almeida's crew is in this directory.,アルメイダの仲間の情報は すべてここよ,1,1
9507,he went that way.,あっちよ,1,1
37016,it is a creature called kouki.,コウキという生き物です。,0,0
30071,"from today, you have been given the name",今日からあなたは名前を与えられました,0,0
3401,how fucking dare you!,どんだけ大胆なのよ!,1,1
15372,"and if there is a trial, i want to take the stand and tell the jury that i'm innocent.",公判が有るなら無実を主張します,1,1
6637,hide the glass!,隠しなさいよ!,1,1
1235,that novel was perverted,見たろう?あの小説を,1,1
57203,It's not a direct cause of dismissal,それは解雇の直接の原因ではない,0,1
33870,tell me?,教えて？,0,0
25095,charlie carrier is 45 degrees off the port bow. six minutes.,チャーリーキャリアは港の船首から45度離れています。 6分。,0,0
26717,i'm glad i fell in love with you.,私はあなたに恋をしたことをうれしく思います。,0,0
43349,What are you talking about,何言ってる ちゃんとしゃべれよ,0,1
59565,To be able to join the network,ネットワークに参加できるように,0,1
39539,there's no doubt that i put on,私が着ていることは間違いありません,0,0
45774,And about 300 players including Asuna,そして アスナは含めた 約300人のプレーヤーが,0,1
7825,that's what namiesan said.,奈美江さん 言ってた,1,1
32619,those pricks!,それらの刺し傷！,0,0
46794,Easy access to the brain,頭脳が簡単にアクセスできる,0,1
29195,don't worry about anything and,何も心配しないで,0,0
18500,what about that girl from the motel?,あのモーテルの女は?,1,1
50892,It's an oil pipeline,オイルのパイプラインだ,0,1
32949,the exact opposite by the powers that be,である力による正反対,0,0
21028,shen!,シェン！,0,0
16185,"doc and 10k, you guys harvest the leaves.",ドクと10kは葉を収穫,1,1
32811,get the fuck out of my face.,私の顔から性交を取得します。,0,0
31269,we can make materials that have incredible strength,信じられないほどの強さを持つ素材を作ることができます,0,0
23250,[laughs] not nearly enough.,[笑い]十分ではありません。,0,0
7974,"hey. for old time's sake, should we do that thing?",ねえ 昔の様に あれを一度やろうか?,1,1
35327,"it's nam gyu man, right?",ナム・ギュマンですよね？,0,0
53358,First young woman in the bathtub crashes to death mother and slaughtered man,最初に バスタブで若い女性 墜落死する母親 そして撲殺される男,0,1
48096,And the nature of law in public and community life will follow.,そして公共生活、共同体生活における 法の性質もそれに従うだろう,0,1
12150,yes. thanks.,ありがとう,1,1
39619,"neesan means elder sister, young lady, miss, waitress. a form of address similar to miss or mister.) yamada!",neesanは姉、若い女性、ミス、ウェイトレスを意味します。ミスやミスターに似たアドレスの形式。）ヤマダ！,0,0
11880,the subcenter is closed. ao you have to come back,閉まっていて 来た道を戻らなくてはいけません,1,1
43426,Seriously,《マジキモい》,0,1
28234,anybody home with him?,誰か彼と一緒に家にいますか？,0,0
