,English,Japanese,good_trans,original_language
7408,i will not do until i suffer,苦しんでまでやるもんじゃない,1,1
4356,locked in.,了解,1,1
22443,two men.,2人の男性。,0,0
52861,So how long?,それでいつまで?,0,1
28182,that's why i hate the rainy season.,だから梅雨が嫌いです。,0,0
10957,until that air conditioning system can start up again.,エアコンのシステムが再起動するまで ビルは使えません,1,1
45241,I want to continue the Happiness Thermos with you ｡,皆さんと一緒に ハピネス魔法瓶を 続けていきたいと,0,1
57508,Saying it's eradication,根絶だと言ってる,0,1
26463,"well, we can look into that after your party.",さて、私たちはあなたのパーティーの後にそれを調べることができます。,0,0
7328,have you heard? about the drowned man?,溺れた男のこと聞いた?,1,1
40238,The ice sheet will continue to thaw for centuries,氷床は数世紀に渡って解け続けるでしょうし,0,1
21921,you will definitely think this is exquisite.,あなたは間違いなくこれが絶妙だと思うでしょう。,0,0
1270,lock that transmision.,通信装置無効にしろ,1,1
30031,"quite humanely, really.",非常に人道的に、本当に。,0,0
10863,"clan by clan, neighborhood by neighborhood.",部族単位になり さらには地域単位にまで広がり,1,1
55855,go!,行け!,0,1
41739,Because they know the prosperity of today's society,彼らは今の社会の繁栄を知っているので,0,1
23922,if he comes home safely,彼が無事に帰宅したら,0,0
3470,and what i hope you can see is that there's all kinds of bacteria there.,見ていただきたいのは、あらゆる細菌がいるということです,1,1
49325,I don't know if I'm glad I was saved.,今も 助かってよかったか どうか わからない。,0,1
59607,Because it's important to spread the power.,力を広める点で 重要だからです,0,1
17035,"then, in 30 minutes, lets meet here.",それじゃ 30分後に ここに集合,1,1
32122,and if i can't find the answer,答えが見つからない場合,0,0
43932,It heats and cools the air.,空気を熱したり冷やしたりしているわけです,0,1
6331,"well, then, dig in.",では召し上がれ,1,1
1918,"hello, beastie.",おはよう、小さなけだものさん,1,1
2637,keep your mouth shut and you'll live.,黙ってたら殺さない,1,1
14472,what's going on?,床上的,1,1
42150,Please rest today,お願い 今日は休ませて,0,1
40795,Where are you now?,今どこだ?,0,1
47140,Compared to C.I.'s,C. I. のものと比較してみたら,0,1
51893,Hmm that's right,ヘッ そうかよ。,0,1
53822,Any information?,何か情報は?,0,1
54352,Isn't Connor too serious?,コナー先生 マジメすぎない?,0,1
57526,Recognized as a member of the long-term care team,介護チームの一員と認識し,0,1
15221,he's still suffering the effects of acute dehydration.,激しい脱水症の 影響が残ってます,1,1
22522,"hopefully, they were out for lunch and nobody was in there once she went boom.",うまくいけば、彼らは昼食に出かけていて、彼女がブームになった後は誰もそこにいませんでした。,0,0
299,"hey, timmy, did you know jack who worked here? mmhmm. what can you tell me about him?",ティミー ここで働いてた ジャックは知ってるか? 彼について話せる事は?,1,1
14160,you called me at home to talk.,お話でしたら ご自宅まで お伺いしましたのに。,1,1
46379,Did the guard talk,警備員が話したか,0,1
27148,is it that it doesn't recognize me?,それは私を認識しないということですか？,0,0
45662,BND must be as unknown as it has ever been,BNDへは かつて経験した事がない程 未知数に違いない,0,1
14773,"yes, they will.",その通り,1,1
29074,"passionate yep, passionate",情熱的なうん、情熱的な,0,0
10539,isn't it headmaster?,そうですなぁ 校長先生。,1,1
52472,Through this program the NSA,このプログラムを通じて NSAは,0,1
53645,Lots of tips because you get good service and they expect it,沢山のチップ なぜならよいサービスを 受けられるし、彼らはそれを期待してる,0,1
52549,This was my first time,これが初めてでした,0,1
38047,there goes august.,8月に行きます。,0,0
3796,i'm good.,素敵なランチに行けば,1,1
4212,cry like an old grandmother and not have my conscience bother me.,良心が痛まんように 泣きながらな,1,1
35812,"agent lisbon, are you besmirching your badge and refusing to answer to protect yourself or to protect patrick jane?",エージェントリスボン、あなたは自分のバッジを侮辱し、自分自身を守るため、またはパトリックジェーンを守るために答えることを拒否していますか？,0,0
30187,"you're here! where were you, uncle sayid?",あなたはここにいます！おじさん、どこにいたの？,0,0
50638,Was it gay?,ゲイだったの?,0,1
27203,christopher poole: when i was 15,クリストファー・プール：私が15歳の時,0,0
16399,"no, let's do this the easy way.",いや 簡単な方法にしよう,1,1
17211,i'm listening mike.,私が聞いてるのよ - マイクだ,1,1
53279,There are other sad people Frank there,他にも悲しそうな人がいる そこのフランク,0,1
34579,soso which is it?,そそどっち？,0,0
45084,I don't need that money,あの金は要らない,0,1
35982,"one, don't build a reformer on a fault.",1つは、障害に基づいてリフォーマーを構築しないでください。,0,0
28253,"but, who is this person? how much is this client worth that you are so happy about this?",しかし、この人は誰ですか？あなたがこれにとても満足しているこのクライアントの価値はどれくらいですか？,0,0
45375,That caused an explosion in London,そのせいでロンドンで 爆発が起こった,0,1
1240,i want to share all my love with you,全ての愛を君と分かち合いたいんだ,1,1
42732,I can't speak,話せないよ,0,1
56729,I made slime mold in just over a day,粘菌はほんの一日強で作りました,0,1
38912,charlie please. i beg you.,チャーリーお願いします。お願いです。,0,0
48806,Brownies and cupcakes,ブラウニーとカップケーキよ,0,1
33563,"of the liver structure, experimentally.",実験的に肝臓構造の。,0,0
29745,that's not harima mika,張間美香じゃない,0,0
51892,It's about the place where you were born.,生まれた場所などと言った事についてです,0,1
45584,Juma knows she can't go home alive,ジュマは生きて帰れないことを知っています,0,1
58314,Why is this happening?,なぜこんなことが?,0,1
8107,the woman in the black dress.,今の黒い女も あんたね。,1,1
19316,mikisan was pushing himself.,三木さん 無理してたみたい。,1,1
13932,"no, nothing.",渺小如我 只要力所能及,1,1
12320,from the universe!,一片の塵も残さず 宇宙より 消し去ってくれるわ~!!,1,1
40748,"This is the work of the drifters, or the drifters,",これは流れ者、あるいは流れ者達の仕業で、,0,1
26724,"anyway, show 'em what you got in the cavalry race!",とにかく、騎兵隊のレースで得たものを見せてください！,0,0
46992,Oh daddy,あっ パパ,0,1
59108,It can't be priced.,それに値段は付けられない.,0,1
35305,not you believe that this finishes here.,これがここで終わるとは思わない。,0,0
2489,have my back and stop being so goddamn disappointing like everybody else!,もっと私の肩を持って 失望ばかりしてないでよ,1,1
20386,shut up! shut up!,うるさい！うるさい！,0,0
6327,from the speculative images,サイエンス・フィクションの,1,1
10037,"i have to, liesel.",出て行くよ リーゼル,1,1
39885,"eh, your coat",ええ、あなたのコート,0,0
51603,Isn't it Mr. Haga,ないでしょう? あの 芳賀先生,0,1
29072,kondo's coming back to the bank.,近藤が銀行に戻ってきた。,0,0
31676,i had no idea my mother and father were such amazing people.,母と父がこんなにすごい人だとは思いもしませんでした。,0,0
43889,It's a gift,贈り物なの,0,1
2837,"technical nutrients this is for shaw carpet, infinitely reusable carpet.",技術的栄養の例は ショーカーペットの 何度でも再利用できるじゅうたんです,1,1
19670,and you'll return the money you owe me.,お金を返す事にする訳だ。,1,1
19150,we will fight for each and every life.,私たちはありとあらゆる 命のために戦うことになる,1,1
37896,but when you look at the natural gas we have,しかし、天然ガスを見ると、,0,0
8113,and being able to do a highly esteemed work at the company.,会社にも評価してもらえる 仕事ができて。,1,1
16144,"go, go, go!",急げ! 早くしろ!,1,1
49033,(Apocalypse 10 -1) You are again,(黙示録10 -1) あなたはもう一度,0,1
36577,go look.,見て行きます。,0,0
57929,"Escape from there, right now",そこから逃れろ、今すぐ,0,1
17378,"he wants to die, too.",彼も死ぬつもりだわ。,1,1
18068,there's no time.,カレン,1,1
57657,At least in front of me,少なくとも、俺の前では,0,1
2442,just please call them up.,頼むから電話をしてくれ,1,1
32379,the tenkaichi tournament finally begins!,いよいよ天下一武道が始まります！,0,0
51699,"In other words, you will go through a parliamentary hearing",つまり 議会の聴聞会を通ることになる,0,1
38624,come home nozomu.,のぞむ帰宅。,0,0
37712,"abi, ab oculis meis!",abi、ab oculis meis！,0,0
11697,"you go out for a jog, you give yourself some routines and pretty soon you find your legs.",日課を作るんだ すぐに慣れるよ,1,1
37204,that person will really investigate alone?,その人は本当に一人で調査しますか？,0,0
36421,what are you talking about?,あなたは何について話していますか？,0,0
59246,I know it's okay,分かってるよ 大丈夫だ,0,1
58411,2 sheets are enough,2枚でいい,0,1
36924,it's for a friend of mine. she's waiting for me. thank you.,それは私の友人のためです。彼女は私を待っています。ありがとうございました。,0,0
45772,Someone is there,誰かいるわ,0,1
57100,They are the cornerstone of this community,彼女たちは このコミュニティの要です,0,1
32729,wouldn't it be great if we could actually harness the power,実際に力を活かすことができたら素晴らしいと思いませんか,0,0
42363,A detailed switch as usual.,相変わらず詳しいな スイッチ。,0,1
479,it's my issue i believe.,私の問題だと思うから。,1,1
43091,try it,試してみてください,0,1
32585,i cannot drink.,飲めない。,0,0
55292,Voice of the heart Did you notice me?,心の声 私に 気付いたの?,0,1
40404,It's strange,不思議だよ,0,1
27578,"why, indeed?",なぜ、確かに？,0,0
58620,Is that so,そうなのか,0,1
13427,some people never give up.,耐え抜く人もいる,1,1
51255,"If you don't cancel the playground, the kindergarten will be blown up.",「お遊戯会を中止しないと 幼稚園を爆破する」って。,0,1
25604,we told city police. never heard anything.,私たちは市警察に話しました。何も聞いたことがない。,0,0
48405,"Listen, I'm breathing free air now",「聞いてくれ 俺は今自由の空気を吸っている,0,1
52852,It is a method to inspect the artery from the inside,動脈を内側から検査する手法です,0,1
17650,about that ultrasuper manpan,あの 超ウルトラ満帆。,1,1
29133,a film also exists in time; it's an experience,映画も時間内に存在します。それは経験です,0,0
12420,"yokoshima, come this way.",ウフフフ ヨコシマさ~ん,1,1
19231,while their fathers are at war.,父親が戦をさせられている間に,1,1
16978,wouldn't you do anything you could to protect her?,守るためなら 何だってするでしょ?,1,1
35682,"roxie, this is emmy. emmy, roxie.",ロキシー、これはエミー賞です。エミー、ロキシー。,0,0
43680,Good appearance and good attack,姿格好といい 攻撃といい,0,1
28703,and what did she do in the meantime?,その間に彼女は何をしましたか？,0,0
18840,what should i do? when such time !? hey hey hey?,どうしたらいいの? こんなとき!? ねぇ? ねぇねぇ ねぇねぇ?,1,1
2192,jacques is your lover?,ジャックがあなたの?,1,1
9076,or to that pillow for that matter.,そこにもね,1,1
4690,"an industry around it, they need to know that their connection",海底ケーブルの力で産業を 発展させるつもりであるならば,1,1
1814,"you a homo thug? man, i ought to kick your ass!",キモイんだよ、引っ込んでろ!,1,1
22831,alvarez and collins are bringing in sionis' minions.,アルバレスとコリンズは、シオニスの手先を連れてきています。,0,0
22957,"well, how do we turn",さて、私たちはどのように向きを変えますか,0,0
54441,I'm watching until I get bored,飽きるまで見ている,0,1
43967,I won't take care of it!,手加減しないぞ!,0,1
13267,i'm still invisible and now i'm all wet.,しかもビショぬれだ,1,1
28332,and place them into hiding.,そしてそれらを隠します。,0,0
26448,"well, hello, mr. toothbrush.",さて、こんにちは、ミスター。歯ブラシ。,0,0
53535,To make a new determination,新たな決意を行うためだ,0,1
33278,"i spit on his d god, i did.",私は彼のd神に唾を吐きました、私はしました。,0,0
43852,"Your mom, not you",あなたじゃなくて あなたのお母さん,0,1
44315,help,助けて,0,1
8390,i take lunch hour.,昼休みだってあります,1,1
22757,in the beginning i did not understand the instructions,最初は私は指示を理解していませんでした,0,0
25516,that the animals are in control of their own actions,動物が自分の行動をコントロールしていること,0,0
23601,so i think after several generations,だから私は数世代後に思います,0,0
28140,the condo site in musashi kosugi.,武蔵小杉のコンドミニアムサイト。,0,0
44117,I'm not even going to my friend's house.,友達の家にでも行ってるんじゃない。,0,1
35435,and their appeal to a largely disillusioned,そして、大部分が幻滅した彼らの魅力,0,0
38272,here you go.,どうぞ。,0,0
12974,don't have a wife. don't have a wife.,妻はいないよ,1,1
10116,the sun end was about four inches in diameter,太陽の側の直径は約10センチメートル,1,1
28837,not much. i figure they called mrs florian after they missed killing moose.,あまりない。彼らがムースを殺すことを逃した後、彼らがフロリアン夫人と呼んだと私は思います。,0,0
44504,Make a decision after seeing it,決定は それを見てから下します,0,1
59581,Both look pass,見た目はどっちも合格,0,1
12098,easy!,痛いよ,1,1
54339,40-45%,40~45%が,0,1
16067,"then make it 3,500 yen. give me some extra. i have a child!","じゃ じゃあ 3,500円。 おまけしてよ。 子供 いんだから。",1,1
23622,and we cannot get over your skin.,そして私達はあなたの肌を乗り越えることはできません。,0,0
52609,It's a picture of a little princess and a maid.,幼い皇女と侍女の絵ですが,0,1
8013,we draw ilaria inside and implode the entire base on top of them.,奴らの上部から爆破させる,1,1
21619,then this january,その後、この1月,0,0
31307,"well, baggins first.",さて、最初にバギンズ。,0,0
24721,and one of the lessons we've been learning,そして私たちが学んできた教訓の1つ,0,0
3578,just get me off of this thing.,だから 私を降ろして,1,1
26464,so the earth bulges a little bit around the middle,地球は真ん中あたりで少し膨らんでいます,0,0
24252,"i think miss longbill would look better in black rather than white, wouldn't you agree?",ミスロングビルは白よりも黒の方が見栄えが良いと思いますが、同意しませんか？,0,0
1822,we did what you asked.,俺達は親父に 頼まれたことをやったんだ,1,1
21731,it's called to my favorite 17yearold high school girl.,それは私のお気に入りの17歳の女子高生に呼ばれています。,0,0
8676,this is a system that relies on kindness and trust,これは親切と信頼に依存したシステムであり,1,1
59849,I talked about it many times and I think I've made an effort,何度も 話し合いました 努力もしてきたつもりです,0,1
28884,that's why they can be difficult to interpret.,そのため、解釈が難しい場合があります。,0,0
52060,The prison is in trouble I need your help,刑務所は困る 君の助けが必要だ,0,1
2024,and again this video was taken right after my daughter was born,娘が生まれた頃に 撮ったので,1,1
5044,you made you!,君は 君自身を 変えた!,1,1
41055,"It used to be a necessary evil, but it's no longer needed",かつては必要悪だったが もはや不要になった,0,1
53574,"Hordo, Hordo",ホードー、ホードー,0,1
48622,I'm trying too hard,頑張りすぎよ,0,1
26879,you can tell me the truth.,あなたは私に真実を言うことができます。,0,0
34486,over the next 15 years,今後15年間,0,0
19697,is that your way of telling us you're not scared?,怖くない振りをしてるのか?,1,1
39112,of the home where you grew up.,あなたが育った家の。,0,0
58278,"There is another problem, although we have overcome the darkness",また別の問題もあります 私たちは闇を克服しましたが,0,1
17694,well miyuki's neighborhood was mitami chan,へぇ~ みゆきさんのご近所さんって みなみちゃんの事だったんだね,1,1
35164,whwhat? what is this?!,なに？これは何ですか？！,0,0
39690,got a visual on a heavily armed commando unit lead by juma himself.,ジュマ自身が率いる重武装のコマンド部隊のビジュアルを手に入れました。,0,0
17732,the stun!,動けない!,1,1
59049,Just shortly before I was contacted by my source,私の情報源から連絡があった ほんの少し前の事だ,0,1
37654,"i don't need a history lesson, your xcellency.",私は歴史のレッスン、あなたの卓越性を必要としません。,0,0
23507,"margo, calm down.",マーゴ、落ち着いて。,0,0
16025,"mark, you're getting married, so i hear.",マーク お前は結婚するって聞いたが,1,1
22842,"after he came of age, he entered nakabayashi construction by way of",年齢を重ねた後、ナカバヤシ建設に参入しました。,0,0
30669,"are those readings, the photometer readings",それらの測定値、光度計の測定値です,0,0
11035,i see nothing!,何も,1,1
23243,you notice that i already broadened the discussion.,あなたは私がすでに議論を広げたことに気づきました。,0,0
29261,come from three spheres.,3つの球から来ます。,0,0
35345,i have a present for you.,プレゼントがあります。,0,0
33716,"because it's quite gruesome, but you'll hear some of the sounds.",それはかなり恐ろしいので、しかしあなたはいくつかの音を聞くでしょう。,0,0
19086,it would be depressing to spend so much time with workers.,気が滅入ってしまわないかと心配でした,1,1
10503,"but the consumer sector, especially in america, is very inefficient.",しかし消費側では、特にアメリカでは、非常に非効率なままだ,1,1
56066,that's right,そうです,0,1
57248,Always understood,常に 分かった,0,1
16307,hows this suit look?,しかし 激闘のさなか 突如 破面たちが撤退してしまう。,1,1
41768,Different types of information are output.,異なる種類の情報が出力されます。,0,1
15551,they want to sign a contract. what contract?,私達と契約したいって - 契約って?,1,1
58720,Is it okay to come with me?,一緒に来て大丈夫?,0,1
36960,i never found out what really happened,私は実際に何が起こったのか知りませんでした,0,0
42590,Even though I was a friend I betrayed me!,友達だったのに 裏切ったな俺を!,0,1
48217,"How many do you think are different? I'm 30 different, but he's crazy.",いくつ違うと思ってるんですか。 私 30違うけど ほれてるわよ。,0,1
26122,"let me be in a drama, a minor role, anything.",ドラマ、マイナーな役割、何でも私にさせてください。,0,0
42833,Do you want room service?,ルームサービスを頼むか?,0,1
15499,she didn't have to come here.,彼女がここに来る必要は なかった,1,1
1670,"look terukun, this is your mother.",輝君 ほら ママでしゅよ~。,1,1
41257,It was in the latter half of the 19th century,19世紀後半のことです,0,1
589,"the mcdonald's bag, and the smell of golden arches",おいしそうな香りがシート越しに漂ってきたら,1,1
27774,the cat sat by the door.,猫はドアのそばに座っていた。,0,0
47141,It means we don't know about it.,我々がそれについて知らないことを意味している。,0,1
2534,"hey, bro, what about us?",俺達は?,1,1
58424,Jim: I got ahead by thinking about another way,ジム:別の方法を考えることで 先行しました,0,1
28671,she'll be back on her feet in no time.,彼女はすぐに立ち直るでしょう。,0,0
18969,as a favor to those they deemed worthy.,とりはからう 権利を持っていました,1,1
52556,I wonder if anyone can call you,あなたに電話だって 一体誰かしら,0,1
9027,and i redefined policing concepts in india.,それがインドの警察のあり方を一新しました,1,1
34330,percy?,パーシー？,0,0
5185,have a nice flight.,お空を楽しめ!,1,1
42947,The final ideal is this slide,最終的な理想は このスライドで,0,1
2063,can i ask something else?,あの もう1つ聞いていいですか?,1,1
59903,You wanted to meet,君は出会いが欲しかったんだな,0,1
7763,ii have to tell her.,彼女に 伝えないと・・・,1,1
40969,They highlight the strange wonders of the human body,彼らは人体の奇妙な 驚異を際立たせ,0,1
47466,Are you a dismissal engineer?,解雇エンジニアだって?,0,1
13400,only for a minute,ほんの一分でも,1,1
42565,I got one piece of information that I was interested in.,気になる情報が一本出たわ。,0,1
37615,social discourse in iran.,イランの社会的言説。,0,0
56265,They worked hard.,彼らは一所懸命に働きました。,0,1
23751,where are you going? to give a friend the benefit of the doubt.,どこに行くの？友人に疑いの利益を与えるために。,0,0
18953,the tac team followed walker here.,TACチームがここまで追跡,1,1
49877,"Let's keep walking, there's nothing we can do anymore",さあ 歩き続けよう もう俺たちがしてやれる事は何もない,0,1
39989,No,いいや カタをつけるんだ,0,1
13882,and she's trying to connect with our computers.,コンピユーターに アクセスするつもりだ,1,1
18329,it wasn't easy.,大変でした,1,1
55603,So I decided once,だから 一度は決心したの,0,1
48970,"Three conductors without performers, Tren (laughs)",演奏者なしの3人の指揮者 「トレン」です (笑),0,1
12984,i daydreamed that my father would ask the king.,父が国王に頼む事を夢見てた,1,1
54218,Making potpourri is fun,ポプリ作りは楽しいけど,0,1
36717,"you're dr. kudou akinori, right? [ kudou is the family name just kept the standard naming in the translation]",あなたは博士です。工藤あきのりでしょ？ [kudouは家族の名前です翻訳では標準の名前を維持しました],0,0
42985,"When I saw my friends fighting and being torn into eight, you were hiding in a hole",仲間が戦って八つ裂きにされるのを見た その頃 お前は穴の中で隠れていたんだ,0,1
59167,Where is Valerie Boon?,ヴァレリー・ブーンはどこ?,0,1
49824,I'll drive you away,私が追い払うから,0,1
30364,they're hard to eat.,彼らは食べるのが難しいです。,0,0
9478,okay! i'll do my best!,うん! お願い! はいっ! 頑張ります!,1,1
36066,how important and warm takemi and the children were,タケミと子供たちがどれほど重要で温かいのか,0,0
2554,kaufman!,カウフマン!,1,1
39731,i can't believe we actually have to go to this thing. there's a huge flyers game on today that i have to see. my research benefited from mr. mirga's donations.,私たちが実際にこのことに行かなければならないなんて信じられません。今日は私が見なければならない巨大なチラシゲームがあります。私の研究は氏から恩恵を受けました。ミルガの寄付。,0,0
43725,I'm looking at the evidence now,今、証拠品を見てるんだが,0,1
32543,what are you talking about? what on earth are you talking about?,あなたは何について話していますか？一体何のことをいっているのですか？,0,0
12371,we were supposed to meet the men in those vehicles.,ここで救助部隊と会うはず だったんだ,1,1
34172,everybody just loved serena.,誰もがセレナを愛していました。,0,0
30153,"how nice, like in the movies.",映画のように、なんて素敵なのでしょう。,0,0
47092,Suspicious kina,话说回来 可疑里的kina是怎么回事呢,0,1
13959,the coordinates.,gps座標ね,1,1
11335,you don't know the ogi i'm talking about.,我当然知道小木老师了,1,1
52370,It's a ridiculous wet garment.,とんでもない濡れ衣です,0,1
13186,go away!,笑顔で 君よとけちゃえ,1,1
