,English,Japanese,good_trans,original_language
2276,there is something strange about that sop sign.,「甘言]標識なんて奇妙なものがあるな,1,1
42239,Leaving New York University's promised position,ニューヨーク大学の 約束された地位を離れ,0,1
26552,the aggregate numbers are overwhelming.,総数は圧倒的です。,0,0
36071,see?,見る？,0,0
22712,tell me who she is. no!,彼女が誰なのか教えてください。いいえ！,0,0
53672,"You win, I'll come out",アンタの勝ちだ 出てくよ,0,1
4522,"and you're familiar, of course",ご存知の通り抗体は,1,1
28470,guess i should have brought the whole jar.,私は瓶全体を持ってくるべきだったと思います。,0,0
36890,i can't take the killing anymore.,私はもう殺害を受け入れることができません。,0,0
7219,it's not like that,是 对 对不起,1,1
31776,"well, i'm sorry. my hands are tied.",まあ、ごめんなさい。私の手は結ばれています。,0,0
47894,The night I was looking for a Nora dog,ノラ犬を捜してた夜,0,1
6629,look how small,どれほど小さく,1,1
35780,"that's not a good idea, babe.",それは良い考えではありません、ベイビー。,0,0
43046,There are millions of z in the west,西には何百万のzがいる,0,1
5407,is that true?,本当かどうか 怪しいもんだぜ。,1,1
24347,i don't want to die!,死にたくない！,0,0
38230,what am i doing?,私は何をやっている？,0,0
32156,"to that point, deep in our collective history",その時点まで、私たちの集合的な歴史の奥深く,0,0
12993,"could you, uh, pass me my magic, uh, mantle of power?",魔法のマント、取ってくれる?,1,1
46497,If I'm smaller and I don't have a kiba-humans aren't afraid to have a session with you,もっと体が小さくてキバがなかったら- 人間は怖がらず君とセッションするぜ,0,1
54314,He has a good feeling,彼は好感がもてる,0,1
1836,no one's ever seen this before.,こんな事は聞いたこともない,1,1
36276,you okay?,あなたは大丈夫？,0,0
30140,this is,これは,0,0
49223,It's a great success. Especially the leading child,盛況だね。 特に 主役の子,0,1
6497,this procedure is done according to the rules of the lower house as well as,この手続きは 衆議院規則 及び。,1,1
28177,"less than 60 seconds after this picture was taken, this guy was dead.",この写真が撮られてから60秒も経たないうちに、この男は亡くなりました。,0,0
39181,why are all those people headed back?,なぜそれらすべての人々が戻ってくるのですか？,0,0
42549,There is another,もう一つある,0,1
25616,"the third, is this too much information?",第三に、これは情報が多すぎますか？,0,0
37507,crunch down,クランチダウン,0,0
44746,Well welcome to modern society,さて 現代社会にようこそ,0,1
7378,so we don't get stuck with bad rules,私達は悪いルールの罠に陥ることなく,1,1
24356,do you know her? yes.,あなたは彼女を知っていますか？はい。,0,0
28156,a little spicy hanaesan?,少し辛いハナエサン？,0,0
38483,you're making that up.,あなたはそれを作り上げています。,0,0
39326,"like war, terrorism",戦争、テロのように,0,0
3510,"if nazir was hiding in there, we'd have found him.",中に居たなら見付かった筈,1,1
58181,I have dedicated everything for humanity-,「私は全てを捧げた 人類のために ―,0,1
8586,"i know, it's okay. okay. okay.",大丈夫?,1,1
35732,"oh, i've seen you.",ああ、私はあなたに会いました。,0,0
47678,It's the same with the POWs,それは 捕虜も一緒だ,0,1
24339,and i know that makes you really sad.,そして私はそれがあなたを本当に悲しくさせることを知っています。,0,0
6082,"olivia, did you hear what i just said?",それを聞きたかったよ,1,1
15775,who are you?,捕まえるとするか,1,1
30762,[so complicated?],[とても複雑ですか？],0,0
54370,In the so-called sweet spot,いわゆる「スウィートスポット」に,0,1
30345,i'm not gonna tell her.,私は彼女に言うつもりはありません。,0,0
58143,Can't you buy it in America?,アメリカで買えない?,0,1
38601,it's been such a good year but you're at home eat cake with your mom.,とても良い年でしたが、あなたは家でお母さんと一緒にケーキを食べています。,0,0
25052,where is caitlin?,ケイトリンはどこにありますか？,0,0
24217,just appearance. normalizes it.,見た目だけ。それを正規化します。,0,0
28238,you see that big yacht lying offshore?,あなたはその大きなヨットが沖合に横たわっているのを見ますか？,0,0
58687,"If you knew it, still with both eyes",もし知ってたら今も両目で,0,1
34702,i love your voice. we both love your voice.,私はあなたの声が大好きです。私たちは両方ともあなたの声が大好きです。,0,0
15011,now who's our boy?,それで 私達の番号は誰?,1,1
2343,i love that. she's taking me to cooperstown on sunday.,そりゃいい - 日曜日のクーパーズタウンに行くんだ,1,1
833,i hope you can satisfy me!,満足させてもらおうか!,1,1
58780,This is the legendary loach scoop of Amemiya Firefly.,これが 雨宮 蛍 伝説の どじょうすくい。,0,1
52237,It's a sad 20 years,悲しい20年だな,0,1
11614,"his fingerprints were all over a mug that got broken, while he was killing his last two victims.",最後の2人の被害者を殺した時に 割れたマグカップの そこらじゅうに彼の指紋が付いていた,1,1
17044,not much. each dot is the home of somebody with withdrawal symptoms.,各々の点は禁断症状の誰かの家よ,1,1
48949,People danced and sang from morning till night,人々は朝から夜まで 踊りながら歌いました,0,1
9538,and we need nine centimeters per second,地球型の惑星を見つけるには,1,1
5020,they ignored us?,無視だと,1,1
59765,Are you calling this a castle?,あなたがお城、これを呼んでいるのか?,0,1
7595,how long till you can shut her down?,エンジン停止まで?,1,1
13143,"okay then, i will send him off to you. yes.",じゃあ 出発させますから。 ええ。,1,1
19076,oh! level up,≪おおッ! またレベルアップ,1,1
59685,No. 2,2番,0,1
27264,it's better to be strangled by a necklace of mexicans,メキシコ人のネックレスで首を絞めたほうがいいです,0,0
43681,Everyone calls it Y.C.,みんなはY. C. って呼ぶ,0,1
44686,Yes. The woman is a hybrid!,はい。 女は 雑種よ!,0,1
2735,do you understand that!,分かってんのか! 貴様に。,1,1
21576,"this time, this person will be accompanying us.",今回はこの人が同行します。,0,0
30122,i'm sorry about this.,ごめんなさい。,0,0
16841,"no, you see, it's more complicated than that.",いや もっとやっかいな ことになるんだ,1,1
42672,Marriage is a hassle ~.,結婚なんて 面倒くしゃいな~。,0,1
56718,leprosy,《もーらい》,0,1
1312,she's just gonna keep pushing and pushing.,とにかく押しにでて ずっと押し続ける気でいるのよ,1,1
55021,To protect Bewick's Wren,シロハラミソサザイを 守るためよ,0,1
57425,Put your hands on your chest,胸に手を回せ,0,1
26697,if i had to analyze this,これを分析する必要がある場合,0,0
12831,one of us needs to go back. you stay here.,私が戻って連れて来るから ここに居てくれ,1,1
41872,What happened?,何があったの?,0,1
59412,And cold rock has dignity,そしてコールドロックに 品位がそなわった,0,1
34149,clearly in need. did they stop to help?,明らかに困っている。彼らは助けるために立ち止まりましたか？,0,0
24301,"oh, looky here.",ああ、ここに見える。,0,0
6035,and the idea is that,このプロジェクトは、,1,1
49734,If the movie is rated,もし映画の評価を,0,1
18671,and tell him to let them airdry this time. i don't want him banging the hell out of my dryer.,ドライヤーは使わずに 外に干してと伝えてね,1,1
57829,who is that?,それは誰ですか?,0,1
16233,and out of these bills are going to come,そして その様な文章は,1,1
46097,Did you really shoot people?,本当に人を撃ったの?,0,1
16635,and through that convergence,さまざまな技術が組み合わされて,1,1
55384,So he,それで奴は,0,1
2615,this is the final,これが最後の 月牙天衝だ。,1,1
45031,Is it lifesaving?,人命救助か?,0,1
13011,it is a matter of monitoring peterson being asked but,頼まれてたピーターソンの 監視の件だけど,1,1
33639,every time we go to see one of these red john suspects,これらのレッドジョン容疑者の1人に会いに行くたびに,0,0
10581,"you think those 2 have become intimate ? well, how about asking them ?",できてるでしょ あの2人。 さあ? 本人に聞いてみたら?,1,1
50497,But when the store's annual contract fee is added to this,けど これに店の年間契約料が 加わるとなると。,0,1
37778,why did you bury seitou hakari?,なんでセイトウハカリを埋めたの？,0,0
53076,[I'm still not sure if I killed him ],[殺害したかは まだ不明ですが・・・],0,1
14175,when asked what it was like to be president of france.,フランス大統領の仕事について,1,1
56307,These threats strengthen each other's actions,これらの脅威が互いの作用を強め合い,0,1
33617,she's honored to have my guest in her house.,彼女は私のゲストを彼女の家に迎えることを光栄に思っています。,0,0
22882,what do you want?,なんでしょう？,0,0
4411,became a parttime employee at the child care center,「児童ケアセンター」の 嘱託として,1,1
29009,"yes, along with the retrial",はい、再試行と一緒に,0,0
47011,Will's knife was submitted to the court as evidence and then sent to the court's evidence vault;,ウィルのナイフは法廷に証拠として提出され、 それから裁判所の証拠保管室に送られた; ウィルの裁判の廷吏の,0,1
52886,"According to government statistics, one in three people over the age of 60",政府の統計によれば 60歳以上の人の3人に1人が,0,1
44879,Of course I don't show it to anyone,もちろん誰にも見せてません,0,1
48849,I can't go to the deck anymore,もはや デッキに出ることはかなわず,0,1
19738,he doesn't understand.,うん 知ってる 知ってる。,1,1
21743,like that moment.,その瞬間のように。,0,0
39226,murderer?,殺人者？,0,0
242,did the marriage meeting actually go well? it did.,うまくいったんですか? そうなんだよ,1,1
20076,god. kirk's murder?,神。カークの殺人？,0,0
40117,"I have to go, my dangerous queen",もう行かねば 私の危険な女王様,0,1
37064,who was it who gave us back our swords?,私たちに剣を返してくれたのは誰でしたか？,0,0
55116,Don't pretend!,ふりじゃねえよ!,0,1
8576,i can't believe chad got promoted again.,なんでジャドばっかり昇進する?,1,1
39591,words are great. we should have more of them.,言葉は素晴らしいです。もっとたくさん持っているべきです。,0,0
10252,you have nothing to worry about.,あなたは何も心配しないで,1,1
47256,Do you remember the Tinsdale case?,ティンズデール事件を憶えてるか?,0,1
47780,"I'm sorry, but I don't have time to talk",悪いが 話してる暇はない 切るぞ,0,1
1246,he's got the card on him.,カードを持ってる。,1,1
58443,An unprecedented luxury liner crashes into the tip of the iceberg,かつてない豪華客船が 氷山の一角に激突して,0,1
53848,"If you want to do it, you can do other things",やろうと思えば 他のことだってできます,0,1
58355,"In other words, it's not working",つまり うまくいってないんですね,0,1
11656,bound to be.,覚悟しろ,1,1
30603,you're a great warrior.,あなたは偉大な戦士です。,0,0
33359,"i can understand it on a cellular level, but hatake telling me he was born in 1501?",細胞レベルでは理解できますが、畠は1501年に生まれたと言っていますか？,0,0
10624,"sit tight, ok? i'll be back.",ここに座っててくれ すぐ戻る,1,1
55340,"Yes, it's my head",そう、頭だ,0,1
41910,Is that important?,そんな大事なことか?,0,1
30913,i'll confirm myself what that reality is.,その現実が何であるかを自分で確認します。,0,0
28320,"and so, we will begin our club activities now",それで、今からクラブ活動を始めます,0,0
6570,"this is my last piece of pride. right when you touch this, our compromise is over.",これは最後のプライドだ触ったら 俺たちの和解はおしまいだ,1,1
9198,wasn't good enough. if you're talking,機能的でなかったということです,1,1
10681,"if you want to learn more about this, participate, be a spectator.",もっと知りたければ、参加して、見物して下さい,1,1
14593,my husband said he wanted me to take aft.,夫が羊水検査をしてほしいって,1,1
8245,odin continues to bring me new friends.,オーディンは新しい友を 次々に連れて来る,1,1
51780,Throw away historical symbolism,歴史的な象徴性を投げ捨て,0,1
17093,garrett wants quinn.,ギャレットは クウィンを必要としている,1,1
10473,"they call you, the bone doctor.",骨の医者って呼ばれてる,1,1
40152,The young lady of the Hasumi detective agency,蓮見探偵事務所のお嬢さん,0,1
39103,"nothing, thanks.",何も、ありがとう。,0,0
28573,and with gated communities,ゲーテッドコミュニティと,0,0
12176,serial killers.,研究分野は シリアル・キラーだ,1,1
35601,"with this stick, i'm going to do three imitations!",このスティックで、3つの模倣をします！,0,0
17771,expelled a favor. yes.,仲原 頼みがある。 はい。,1,1
56168,"The people I gave here were taking on great challenges, both individuals and professionals.",私がここあげた人たちは 個人であれプロであれ 偉大な挑戦をしていた,0,1
36753,what? that's what you said to me when i went for my weapon.,何？それは私が私の武器に行ったときにあなたが私に言ったことです。,0,0
9342,wrong!,それは。 違う!,1,1
49600,What is the most important thing in life?,人生で最も大切なものは何だい?,0,1
18846,the waterworks.,上水道だ,1,1
36539,where i was the only black kid invited,私が招待された唯一の黒人の子供だったところ,0,0
52976,It's the tendency to find some pattern.,何かパターンを見つけだそうとする傾向のことです,0,1
49618,There are many Hokage candidates.,火影候補なら いくらでもいる。,0,1
16672,don't mentioned it. i want to get to know my client's as much as possible.,いや いいんだよ。 依頼人の事は 少しでも多く知りたいもんでね。,1,1
1088,look closely,よーく見ると,1,1
25228,i just want things to be simple again.,もう一度シンプルにしたいと思います。,0,0
31603,how can i help you from there?,どうすればそこからあなたを助けることができますか？,0,0
45256,"It's not okay, just girls and robots.",大丈夫なわけないだろ 女の子とロボットだけなんてさ。,0,1
49717,He said he was a current offender,現行犯で って言ってた,0,1
42517,I don't think you should be content with it,決して それに甘んじるべき ではないと思います,0,1
39764,he even cancelled the workshop that was planned for next month in hong kong since,彼は来月香港で予定されていたワークショップをキャンセルした。,0,0
49237,do you eat Serina too?,《芹菜も食べる?》,0,1
16640,with.,一員よ,1,1
35475,"binary brioche, ram sandwiches",バイナリブリオッシュ、ラムサンドイッチ,0,0
20829,"i hope so, your majesty.",私はそう願っています、あなたの威厳。,0,0
12923,doubt is our product,疑いは我々の生産物,1,1
12738,use calls to stay in touch with one another,鳴き声で互いの所在を確認します,1,1
16048,because i had wanted to tell you in person.,先生には お会いした時に お伝えしたかったので。,1,1
53581,Should be vibrating at 11 hertz,11ヘルツで振動しているはずだ,0,1
47995,"Nelson, you're really good ass.",ネルソン、いいケツしてるよマジ。,0,1
27844,i can't tell.the windows are tinted.,わかりません。窓は色付きです。,0,0
3724,but only with each other's help.,それは互いの助けがあってこそです,1,1
38228,send me to kill your enemies.,あなたの敵を殺すために私を送ってください。,0,0
28053,aren't you tired of lying?,嘘をつくのにうんざりしていませんか？,0,0
45296,"My daughter's bracelet, what do you mean?",娘のブレスレットだが どうゆうことだ?,0,1
14793,how could you lose him?,どうして彼を見失ったの?,1,1
23831,that i may crush thine enemies.,汝の敵を打ち砕くために。,0,0
12405,i think we got through.,吹っ切れた様子ですな。,1,1
52204,Where are Fitz and Sky?,フィッツ と スカイ は どこですか?,0,1
40407,"Start up, Rex",起動しろ、レックス,0,1
13396,deity beam!,神様ビーム 神様ビーム 神様,1,1
11497,this is the first time it's written on the windscreen.,フロントガラスは初めて。,1,1
50969,People who die in conflict in Africa,アフリカでは紛争で亡くなる人は,0,1
52956,Noisy! Why do you do this !?,うるさい! なぜ こんなこと するんです!?,0,1
35944,for cleaning up.,片付け用。,0,0
1970,oh no!,あらそうなの,1,1
38986,fear me!,私を恐れて！,0,0
48014,This park will be closed and your work and achievements will be robbed,このパークは閉鎖され 君の仕事も成果も奪われる,0,1
18470,"how did you end up in jail? this was just a few weeks ago, i believe, yeah?",どうやって刑務所に? 数週間前のことですよね,1,1
2948,"lieutenant, we got a 1614 on progress on taylor and seasons.",「警部補 16 -14事態が テイラーの店で進行中です」,1,1
4351,oliver.,オリバー!,1,1
37444,"the last time i saw kevin was, like, a year ago.",私がケビンを最後に見たのは、1年前のようなものでした。,0,0
7939,how's anybody gonna know we're alive?,誰か 生きてるの知ってるのか?,1,1
53773,"There is a warning, but don't stick to it",警告が出てる だけど、それにこだわるな,0,1
55804,From friends who used to invite me to play in the sea or mountains,前は海とか山とか遊びに 誘ってくれてた友人たちから,0,1
36018,the rest of you lock down both ends of the block until we get this guy out of here. understood?,この男がここから出るまで、残りの人はブロックの両端をロックします。了解した？,0,0
58368,Hello Hitman 11 This is Widow 13,ハローヒットマン11 こちらウイドウ13,0,1
14513,here?,ここ?,1,1
47417,Believe only this,「これだけは信じて」,0,1
2210,"so, you see that this airplane is more a symbol.",だからこの飛行機はまさにシンボルなのです,1,1
7174,the association doesn't like loose ends.,連合は いい加減なケリのつけ方は 好きじゃない,1,1
30070,"aa. even if i die, i'll go. even by myself, i'll go.",aa。死んでも行きます。一人でも行きます。,0,0
6960,"thank you so much, god!",か 神様 ありがとうございます,1,1
28290,"you try to lead by example, and they want you to lead, and then they resent you for it.",あなたは模範を示してリードしようとします、そして彼らはあなたにリードして欲しいと彼らはあなたにそれに対して憤慨します。,0,0
40485,It's like my mother and I did,私と母がしたようなものですね,0,1
57537,Last year I was sent to a hospital a lot!,去年なんて 山ほど病院送りさ!,0,1
33090,the determination to get there is why i'm sitting here now.,そこにたどり着く決意が、私が今ここに座っている理由です。,0,0
14112,but what was that voice i heard just now?,でも 先聞こえたのって何だったの,1,1
9350,it's not?,日焼け止めを塗ってないの,1,1
57088,What language is that guy talking about?,そいつ 何語話してるんだ?,0,1
39489,no! no! no! i'm not lying to you! no! no! no! no!,いいえ！いいえ！いいえ！私はあなたに嘘をついていません！いいえ！いいえ！いいえ！いいえ！,0,0
57701,Disappears as it is,このまま消える,0,1
27941,don't come!,来ないで！,0,0
6624,behind the teacher's desk who knows all the answers.,答えを全部知っているという方法はやめて,1,1
26719,ginko san here to you to ask about rebuilding,銀杏さん、再建についてお伺いします,0,0
44737,Then was there a camera after all?,じゃあ やっぱり カメラは あったのか。,0,1
53615,Let's check your value,お前の値打ちを確かめよう,0,1
50771,It might be nice to have a shelter,避難所があるってのも いいかもね,0,1
25181,that's it!,それでおしまい！,0,0
53671,What about your dads?,パパたちは?,0,1
37395,are you guys serious?,あなたたちは本気ですか？,0,0
8593,that there's nothing more painful than childbirth,出産ほど痛いものはないでしょう,1,1
48097,Wouldn't have,なかったでしょう,0,1
22446,"they have been, you know, concerned with water and fertilization.",彼らは、あなたが知っているように、水と受精に関心を持ってきました。,0,0
40486,It's been a long time ~.,久しぶりだね~。,0,1
41312,Because this hospital is old,この病院は古いからな,0,1
24948,is this drama part even necessary?,このドラマの部分も必要ですか？,0,0
53616,The Rain family was a mighty clan,レイン家は強大な一族だった,0,1
2642,do you know how to sum cells? what's that?,SUM関数とか分かる? 何すか? それ,1,1
29894,i got the alley.,私は路地を手に入れました。,0,0
41045,I tried to find out at the laboratory,研究所で究明しようとした,0,1
50954,The result was said. I think she was amazing!,結果 言われていた。 私は すごかった!,0,1
15527,right now. huh? right now?,今すぐ。 え? 今すぐ?,1,1
33636,was that a crack about ogres? you get your royal highness to far far away before i kick it there!,それは鬼についての亀裂でしたか？私がそこに蹴る前に、あなたはあなたの殿下をはるか遠くに連れて行きます！,0,0
4771,not a proud community.,誇り無き民族と,1,1
52217,Ah. Angry?,あっ。 怒った?,0,1
15133,do you want to?,カップルだと思われたいの?,1,1
8928,"mike, this is not about henry.",マイク ヘンリーじゃないわ,1,1
28248,we're coming north and low.,私たちは北に向かって低くなっています。,0,0
15744,i love the water.,私は水が大好き,1,1
15074,to want to have a heart,高貴な任に堪えること,1,1
51445,He looks fine. President!?,彼 元気そうですね。 社長!?,0,1
40067,If you know the contact information of Mr. Sekiguchi of the same company,同じ会社の関口さんという方の 連絡先が分かれば,0,1
27275,are you okay?,あなたは大丈夫？,0,0
38007,than just your doctor alone.,あなたの医者だけではありません。,0,0
49559,Oi,おい,0,1
25159,i want to talk to that son of a bitch.,あの雌犬の息子と話したい。,0,0
30566,sahara. it happens to you women.,サハラ。それはあなたの女性に起こります。,0,0
8224,how many of you can actually tell wheat apart from other cereals?,小麦を他の穀物と見分ける事ができる方はどれくらいいらっしゃいますか?,1,1
51767,A real crow.,本物の カラスが。,0,1
35217,all the more so if my efforts are to be evaluated somewhat.,私の努力がいくらか評価されるのであれば、なおさらです。,0,0
19623,"target, 10 yards from flashpoint.",敵は引火点まで10ヤード ザッ,1,1
59406,How do you get this number?,この番号をどうやって?,0,1
48557,Fallen .. My Lord ..,フォールン. . 我が主よ.,0,1
59414,please,お願いだから,0,1
24677,i need help checking these addresses.,これらのアドレスを確認するのに助けが必要です。,0,0
59668,Human grief,被遺留下來的人的悲傷,0,1
41479,Is it a turn?,順番決めか?,0,1
21344,"i i kept thinking, after ifif we had known each other when i was growing up, maybemaybe i could've helped, maybe he wouldn't be where he is now.",私は私は考え続けました私が成長していたときに私たちがお互いを知っていたなら、多分私は助けることができたかもしれません、多分彼は彼が今いる場所にいないでしょう。,0,0
58408,Come see the gym,ジム 見に来て,0,1
51982,Tell me your name,名前を教えてくれ,0,1
32256,coffee and muffin.,コーヒーとマフィン。,0,0
51808,There is nothing I want you to do.,あなたに してほしいことなんて 何一つ ない。,0,1
17478,i've got it.,分かったぞ,1,1
24913,"and in the mri and mr spectroscopy here, the",ここのmriおよびmr分光法では、,0,0
33523,i'm on tv. i've got to call home.,私はテレビにいます。私は家に電話しなければなりません。,0,0
52670,Did you get scared at all?,もしかして、少しも怖くなかった?,0,1
3053,gonna pour you a drink.,ワイン注ぐわね,1,1
39888,"shiguresama, i return your name.",しぐれさま、お名前をお返しします。,0,0
