,English,Japanese,good_trans,original_language
24139,"put down a layer of calcium and then carbonate, calcium and carbonate.",カルシウムの層を置き、次に炭酸塩、カルシウム、炭酸塩を置きます。,0,0
2833,and that i was only scratching the surface,実はここに始まり,1,1
41783,If my subordinates had family problems,私の部下が家族の問題を抱えていたら,0,1
33916,who are those guys?!,それらの人は誰ですか？,0,0
43522,"This time, I would like to thank the chairman for his kindness.",このたびは 会長先生のご好意をいいことに,0,1
41170,It's an idea that has n't been realized yet.,未だ実現されていないアイデアです,0,1
53845,You have a duty to realize that vision,あなたにはそのビジョンを 実現する義務があります,0,1
44803,I licked the edge of that child's ear and he was cured,あの子の耳の縁を舐めたら治ったのよ,0,1
39050,"and we could see, actually, compared to three genomes",実際、3つのゲノムと比較して見ることができました,0,0
555,to provide for them is also your obligation.,提供するのは あなたの義務でもあるのよ。,1,1
16064,an editor,画家なら ともかく マンガ家の手伝いなんて,1,1
57290,This is a special mountain,ここは 特別な山なんだろ,0,1
2108,"welcome back. guess what, trunks.",分かってねえのは そっちだろう。,1,1
16198,the last search that hanley ran.,ハンリーが最後に見てた,1,1
30381,"have things they're good at, and things they aren't.",彼らが得意なこととそうでないことを持っています。,0,0
57624,"that's right, but",そうだけど,0,1
15192,"whoa, where you going? you threw me offbalance!",どこ行くんだ バランスが崩れる!,1,1
53100,It ’s based on the idea of ​​covering it.,覆ってしまうというアイディアを 基にしたものです,0,1
57276,I checked his personal belongings,彼の身の回り品は 調べたが,0,1
38754,"well, that's exactly what i want to talk about today",まあ、それはまさに今日私が話したいことです,0,0
40450,Let her go,彼女を放せ,0,1
48588,7th Pain.,7人目のペイン。,0,1
41839,The canvas is made in the Netherlands,キャンバスはオランダ製で,0,1
2550,who have so generously supported this research.,setiへの多大なるご協力を感謝します,1,1
30887,what's weird?,何がおかしいの？,0,0
22198,we're getting out of here.,ここから出てきます。,0,0
29207,okay!,わかった！,0,0
7675,you have the kindly look of a saint,仏みたいな優しい顔してるけど,1,1
27793,young beauty! young beauty!,若い美しさ！若い美しさ！,0,0
12519,"i got her, harold.",捕まえた ハロルド,1,1
630,you are in control.,間違いなく あなたのせいなのよ,1,1
43375,Temera!,てめぇら!,0,1
1408,he spent seven years with the fbi counter terrorist division.,彼は 7年もFBIの対テロ部門に居た,1,1
29105,while you gals were in the changing room,あなたのギャルが更衣室にいた間,0,0
41472,"In another experiment, I got on my feet and left Konoha.",別の実験で 足がついて 木ノ葉を出ることになったの。,0,1
13029,why else would she ask?,だから聞いた,1,1
38243,tear her apart.,彼女を引き裂く。,0,0
22821,i guess that's what happens when you don't eat for three months.,３ヶ月食べないとそうなると思います。,0,0
3288,time's running out for me.,俺は もう時間切れだ,1,1
9413,"everyone, report the situation!",みんな 現状を報告してくれ。,1,1
19661,"well, this suggests a deeper, more personal relationship.",これはね、もっと深い個人の 関係じゃないかってことなの,1,1
9516,there is a disorder of this shinobi world that produced that pane,そのペインを生み出した この忍の世の無秩序が,1,1
49071,I want to hear it,それを聴きたくなってしまう,0,1
52418,Don't cry because I'm asking Donna,頼むから 泣かないで ドナ,0,1
9786,you got something to say?,文句なら言わせねえぞ,1,1
1520,can easily dissolve soluble lithologies,溶けやすい岩を溶かすことで,1,1
24939,of course not.,もちろん違います。,0,0
6429,you never be american ok?,お前アメリカ人じゃないだろ?,1,1
12686,this dude is talking about killing people. can he see us right now?,ヤバイ奴だぞ 見られてるんじゃ?,1,1
14748,where are you looking?,どこを見てるの?,1,1
4712,figure that's the first place you guys look to bust guys like me.,かわいいネルソン 何だって?,1,1
45980,Even though I don't know anything about Jesse,ジェシーのこと 何も知らないくせに,0,1
2529,did you know that?,そんな事 分かってる,1,1
50770,Do you mean I'm special?,私が特別だっていうこと?,0,1
32440,i'm here for a job interview with human resources.,私は人材との就職の面接のためにここにいます。,0,0
18436,never makes things easy!,そう簡単じゃない!,1,1
16411,don salamanca.,〈サラマンカさん〉,1,1
30407,the sister is about to die,妹はもうすぐ死ぬ,0,0
49437,Finding out if Michael and Sean are former soldiers,マイケル とショーンが 元兵士かどうか調べている,0,1
29586,taken from the police national computer,警察の全国コンピュータから取得,0,0
25203,what??,何？？,0,0
42426,Is it a quote from Franklin Roosevelt?,フランクリンルーズベルトからの引用か,0,1
59093,Where on earth are you?,一体どこに居るの?,0,1
9881,and together with this new type of interfaces,新しいインタフェースと合わせて,1,1
27323,"well, that's a step in the right direction.",まあ、それは正しい方向への一歩です。,0,0
463,that get forgotten or missed,チェックをしないと 忘れられたり見逃される,1,1
31538,"those five lives, you have to carry that.",それらの5つの命、あなたはそれを運ばなければなりません。,0,0
33674,think i'll take two chickens.,私は2羽の鶏を取ると思います。,0,0
13490,"and indeed, this is just one of the examples",まあ これは一例なんです,1,1
21120,how radial they are all information that may not be,それらがどれほど放射状であるかは、そうではないかもしれないすべての情報です,0,0
24593,we already broke up though.,私たちはすでに解散しました。,0,0
19953,what's this?!,≪この ド変態!,1,1
267,"not on my watch, pal.",「どうなるか覚悟しろよ」,1,1
3913,but actually,実際には・・,1,1
7324,carolyn givins.,キャロライン・ギビンス,1,1
3242,"thank you, floriana.",ありがとう フローリアナ,1,1
8634,grab the ammonium nitrate. speed up the condensation?,硝酸アンモニウムを!,1,1
56134,How was it?,どんな具合だったの?,0,1
14707,"kiss me, james.",キスして ジェームズ,1,1
13984,to your home,お家のためなんかじゃありません。,1,1
19149,double x!,ダブルクロス!,1,1
8192,our master,我會保護公主的,1,1
6433,already good night ?,もう「お休みなさい」?,1,1
25216,"pick them up, take them to motels",それらを拾い、モーテルに連れて行ってください,0,0
33016,but what part of the street.,しかし、通りのどの部分。,0,0
32817,"flying reindeers, shimmying down chimneys.",飛んでいるトナカイ、煙突をシミーダウン。,0,0
55247,Let's do it!,バシバシやったれ! おう。,0,1
10817,i'm glad tom likes you.,そりゃ良かったじゃないか お前になついてて,1,1
56796,If paid,支払われれば,0,1
6700,right,すぐ戻る,1,1
19728,the first time we meet.,初対面でなかったら・・・ すみません,1,1
54626,It's tough,タフなの,0,1
34544,which one? all of them.,どれ？それらのすべて。,0,0
31564,toomuchtime'sgoneby. you'd be one of them by now.,toomuchtime'sgoneby。あなたは今ではそのうちの1人になるでしょう。,0,0
22027,and change its nature into an electric current.,そしてその性質を電流に変えます。,0,0
41155,It's all over,全て終わりだわ,0,1
58744,I thought the same way,同じように考えてた,0,1
56279,Is there a reason to meet my daughter?,娘に会うのに理由がいるのか,0,1
2001,"then, if you want, you can follow me.",なら ついてくればいいでしょ,1,1
36752,"solid, practical choice.",堅実で実用的な選択。,0,0
9087,you'll be late if you keep talking.,ウダウダしてっと遅刻すんぞ,1,1
57014,Active when anime hallucinations occur,アニメの幻覚発生時に活動しています,0,1
57850,My sister is obliged to listen to her sister's selfishness.,姉というのは 妹のワガママを聞く義務があるのです,0,1
23781,i didn't know a trade. couldn't drive a car.,私は貿易を知りませんでした。車を運転できませんでした。,0,0
838,"images like the ones i've shown you, even just",私が見せたような画像 さらには,1,1
51970,Asuka Morikawa regained consciousness,森川明日香さん 意識を取り戻しました,0,1
9596,where are you?,頭が良かった?,1,1
18248,his name is noburo mori.,モリ・ノブロウ,1,1
50879,But the scars are very clean.,でも 傷跡が とても きれいです。,0,1
16041,come sit down.,座ろう,1,1
54099,Special class at the cram school. again?,塾の特別授業。 またか?,0,1
15689,"it's got to get into people's houses, into the bedrooms",この蚊は人家、寝室や,1,1
23076,what are you saying?!,何を言っている？！,0,0
9194,everyone here is out playing around at night.,皆で夜遊び,1,1
3952,that would be a department of justice,それは司法省の範疇に入る,1,1
35949,that's good.,それは良い。,0,0
36194,"of course, men were having sex as well",もちろん、男性もセックスをしていました,0,0
52806,What should i do,どんなのがいいですか,0,1
21862,oh. you were a terrible student.,おお。あなたはひどい学生でした。,0,0
18276,upholstered in flesh and cloth.,14世紀になってからだ,1,1
10331,shuuichi dirtied the saotome name.,修一は 早乙女の名を 汚した。,1,1
23387,it comes from the 1980s and the 1990s,それは1980年代と1990年代から来ています,0,0
18337,i couldn't make a diagnosis of adhd.,adhdとは診断できませんでした,1,1
9292,what is it?,何だろう?,1,1
55708,"And when the sun rises, I promise,",そして日が昇った時、約束する、,0,1
51573,Start running now,今走り出せ,0,1
55710,Climate change gets out of hand,気候変動が手に負えなくなるのを,0,1
14491,impeccable timing is all.,良いタイミングだよな,1,1
2040,i think we may have misread this situation.,この状況を 誤解したかもしれない,1,1
23555,this is just a muddler.,これはただのマドラーです。,0,0
3415,"hey, that's the media's word, not mine.",おい それはマスコミ発言で 私じゃない,1,1
42390,Do it yourself,自分でやれ,0,1
19241,"hey, sen! are you listening to me?!",そんな傷だらけの顔で行く気か? あっ そがん ひどかか?,1,1
11844,i am princess bastemon.,私はここまでだ。,1,1
37470,it's not that big a crime as yet. turn it off!,まだそれほど大きな犯罪ではありません。消して！,0,0
23173,"you being in my head, it's so weird.",あなたは私の頭の中にいる、それはとても奇妙です。,0,0
26312,"if i recall correctly, your boyfriend has the same exact name as you",私が正しく思い出せば、あなたのボーイフレンドはあなたとまったく同じ名前を持っています,0,0
46608,It's better to leave that to the album clerk.,そういうのは アルバム係に 任せたほうが いいって。,0,1
46062,"October 22, 2011",2011年10月22日,0,1
13861,i didn't scream.,叫ばなかった,1,1
8948,"goodbye and good riddance, malibu.",さよならマリブ せいせいした,1,1
39403,"for thin and long things, we use hon to count",細くて長いものについては、honを使用して数えます,0,0
36129,i came back from the dead.,私は死から戻ってきました。,0,0
6448,"all the people that we've killed, gale and the rest.",私達が殺した人たち皆、 ゲイルや他の、,1,1
35366,"hey, where's my beer?",ねえ、私のビールはどこ？,0,0
57756,Is it a terrible mother?,ひどい母親でしょう?,0,1
10649,your parents,君の親が,1,1
54799,The future is always-,常に将来が―,0,1
41476,Avoid sharks,サメ避けさ,0,1
2340,"one will put a black bag over your head, and the other will ziptie your wrists.",1人はあなたの頭の上に黒いバックを置く もう1人はあなたの手首を紐で結ぶ,1,1
1139,only that we don't have any right now.,今停電していることぐらいは。,1,1
47649,Your husband is happy.,あんたの旦那さんは 幸せやなぁ。,0,1
44488,I had something to say to you.,あなたに 言っておきたい事があったの。,0,1
58344,You are brave,君は勇敢だ,0,1
18166,i do not need unnecessary grasping blade i'm beyond possible?,总而言之请不要把刀刃对着我可以吗?,1,1
11625,that's what you think.,そいつは甘い,1,1
19002,hey he taught me an unexpected future,ねぇねぇ 突飛な未来を教えてくれた,1,1
55404,How did his parents really feel about it?,本当なら 彼の両親は その事について どう感じていた?,0,1
29086,this girl here is one of them.,ここのこの女の子はそのうちの一人です。,0,0
9627,"please, let us handle the media.",メディアのことは 我々に任せて欲しい,1,1
24088,i think it's some kind of cognitive transmitter. you inject it like a serum.,ある種の認知送信機だと思います。あなたはそれを血清のように注入します。,0,0
14354,jesus christ.,まったく!,1,1
56137,What did you say?,なんだって?,0,1
28619,"what do we do, taiki?",大樹、どうする？,0,0
31156,"very nice, manamisenpai.",とても素敵な、マナミ先輩。,0,0
9436,"it's faint, but i can still sense them.",《かすかだが まだ感じるぜ。,1,1
40277,Who will help you?,誰が助けてくれるって言うんだ? 自分たちで,0,1
30627,she thinks i'm some kind of goof or something.,彼女は私がなんらかの愚か者か何かだと思っています。,0,0
36364,so our priority is getting them out.,だから私たちの優先事項はそれらを取り除くことです。,0,0
49038,It's not a mess!,ないないづくしだ!,0,1
36575,arch your bows!,あなたの弓をアーチ！,0,0
38043,"but we, spain, will back you up with all our might.",しかし、私たちスペインは、全力であなたをバックアップします。,0,0
55174,I'm both involved in this case,僕もこの事件に関わっている 両方だ,0,1
36613,it's a family store.,ファミリーストアです。,0,0
40217,Return to beast again,再びケダモノに戻る,0,1
48900,Are you aware? I think the bad guys are always two steps ahead,気づいてる? 悪者はいつも 2歩先をいってると思え,0,1
42256,What's going on,どうなっちゃうんだよ おふくろ。,0,1
15058,running.,走っている,1,1
55782,Do what you are best at,一番得意なことをしろ,0,1
50219,Identified power surge from one of three,3つのうちの1つからパワーサージを特定した,0,1
25691,"there is a switch, and i will find it.",スイッチがあり、見つけます。,0,0
21492,because you're so needy.,あなたはとても困っているからです。,0,0
55062,That's why Tom played two roles alone.,だからトムは一人で二役演じたわけです,0,1
4684,"ok, i understand",分かったよ,1,1
8723,i remember you tossing me into an abyss.,お前に奈落の底へと,1,1
43251,Arena?,アレーナ?,0,1
37233,waiting for someone to awaken it.,誰かがそれを目覚めさせるのを待っています。,0,0
59583,Of course I promise,もちろんだとも、約束するよ,0,1
27084,"i'm trying to help you, will.",私はあなたを助けようとしています、意志。,0,0
3991,and isn't that what your facemash was about?,フェイスマッシュも同じだ,1,1
53807,My brother What kind of trouble is it?,兄さんが どんなトラブルなんだ?,0,1
34084,math is a great way to do that.,数学はそれを行うための素晴らしい方法です。,0,0
46141,Nowhere else to go Divorce stripped everything,他に行くところが無い 離婚で 全てむしり取られた,0,1
7269,he went to university in kochi city,あいつ 高知市の大学 行ったがやけど,1,1
9189,"no, i saw him at the hospital yesterday, and",いいえ 昨日病院で会ったけど すぐに帰り--,1,1
58016,It seems that the stock price of the Teino Group is going well today as well.,今日も帝野グループの株価は 順調に推移してるようだな,0,1
46793,Where did you remember,何所で覚えた?,0,1
17637,it's a bust.,失敗だ,1,1
22530,he didn't lose nothing.,彼は何も失いませんでした。,0,0
25422,what is this training?!,このトレーニングは何ですか？！,0,0
56167,circle!,円陣!,0,1
41022,Don't you think he's chasing us now?,お前、アイツが今、俺たちを 追いかけてると思わないの?,0,1
36880,"i'm not getting any younger, so hopefully soon.",私は若くなりませんので、うまくいけばすぐに。,0,0
55527,I want to meet you. I was bad.,会いたいんだけど。 俺が 悪かった。,0,1
49510,Low-income countries are here,低所得の国がここに,0,1
15226,had to be trained for hiv.,HIVに関する教育が必須となったのです,1,1
45696,It's a sweet place called bean paste female fall that was recently made ｡,最近できた 餡泥牝堕とかいう甘味処でね,0,1
11928,are you sure you know where she lives?,ホントにどこに住んでるのか 知ってるのか?,1,1
23803,i have no interest in others.,私は他人には興味がありません。,0,0
5952,"you dating anyone right now, honey?",今付き合ってる奴は 誰かいるのかい?,1,1
22981,because nobody ever describes what a man is wearing.,男が何を着ているのか誰も説明していないからです。,0,0
52575,"It's okay, so get on fast",いいから早く乗れ,0,1
9750,let me guess. it doesn't match erik haas' dna.,エリックじゃないな,1,1
45071,What is the suspicion?,何の容疑で?,0,1
9704,get in there and get your dad.,お父さんを連れ出す,1,1
4431,come on! riki!,ほら! リキ!,1,1
8500,on the minor road entering the major.,”止まれ”は理にかなっていますが,1,1
41286,So even from a selfish point of view we are better than in the past,だから利己的な観点からでさえも 私たちは過去したことよりも,0,1
26049,how is it?,どうですか？,0,0
42547,I was wondering if it's resistant.,耐性ついてるかな~って 思ってたんだけど。,0,1
3959,your work has been very impressive so far.,あなたの仕事が とても印象的でした,1,1
9030,but today the internet connects people with the same deviant tendencies.,けれど 今では ネットで 同じ仲間に出会える,1,1
41430,Is it a man?,男か?,0,1
57988,Because they both have mastered the abilities they need.,何故なら両者はそれに必要な能力を マスターしているからです,0,1
44499,To correct income disparity before and after tax,税引き前後の所得格差是正に,0,1
2885,good night! g'night!,お疲れさまです。 お疲れ。,1,1
43716,Then when will that time come?,じゃあ その時期とやらは いつ 来るの?,0,1
40149,That's why Teddy is the insurance that I got from the deposit.,そんなわけでテディは預からせてもらった 保険というやつだな,0,1
33754,we'll be within range of london in the next five minutes.,次の5分でロンドンの範囲内になります。,0,0
36028,"tom, so you're across it",トム、だからあなたはそれを横切っている,0,0
1758,well done!,良くやった,1,1
33998,don't you know how old i am?,私が何歳かわかりませんか？,0,0
1988,that's right that kind of thing.,そうか そういうことか。,1,1
38984,were those your parents' doppels?,それらはあなたの両親のドッペルでしたか？,0,0
770,you tried to help her.,彼女を助けようとしたが,1,1
58664,I don't even touch her,彼女には触りもしない,0,1
16124,"if you think of anything that might help us find her, please",何か思い出したら どんな事でも,1,1
35044,it was necessary to let someone hear the voice shouting dead kanzaki!,死んだ神崎を叫ぶ声を誰かに聞かせる必要がありました！,0,0
55424,Let's go,さあ 行きますよ,0,1
46203,This is the data,これが データです,0,1
29817,i heard everything you said.,私はあなたが言ったすべてを聞いた。,0,0
7596,"may not crazy,maybe that's the wrong word.",おかしくないだろうし そう言うのも間違ってる,1,1
28570,get out,出て行け,0,0
49699,What about Oseltamivir?,オセルタミビルは?,0,1
15673,was changed.,すっかり変わってしまったのです。,1,1
33816,i never liked to follow the crowd.,私は群衆を追いかけるのが好きではありませんでした。,0,0
44065,Also in newspapers and magazines,新聞や雑誌にも載っている,0,1
20243,you must free the monkey king.,あなたは猿の王を解放しなければなりません。,0,0
11313,he is not deceived who knows himself to be deceived.,彼は騙されない 誰が自分自身が騙されると知ってる,1,1
2877,this number that was entered in as maki,この 「マキ」と登録されてる番号は,1,1
55069,Well then,じゃ いいや。,0,1
16781,"it's a backwater system, two suns, one habitable planet.",2つの太陽がある惑星だ,1,1
53428,His father informed me that it was his recent son's address.,最近の息子の住所だと言って 彼の父親がここを知らせてきた,0,1
49413,It's the exact opposite of me,私と 正反対ね,0,1
544,[woman] hello?,モーリン?,1,1
20686,and one bowl of delicious goldfish crackers.,そしておいしい金魚クラッカーのボウル1杯。,0,0
20296,you think you better than everybody else?,あなたはあなたが他の誰よりも優れていると思いますか？,0,0
44491,Head straight to the castle tower.,一直線に 天守閣へ向かえ。,0,1
55314,Uncle phone,「叔父電話」です,0,1
29355,"and i say to young kids everywhere, as you're growing up",そして私はあなたが成長しているので、どこでも若い子供たちに言います,0,0
4228,"yup, no one saw me.",とばすぞ! うん!,1,1
11436,let's start by adjusting the belts.,そういえば 君は出身とか聞かれなかったけど,1,1
1260,"hey, we should get going.",おい もう行った方がいい,1,1
40779,I went to Parsons University,パーソンズ大に行ったわ,0,1
53443,How different life would have been without being physically handicapped,身体が不自由にならなければ 人生はどんなに違っただろう,0,1
11718,i don't remember much.,覚えていて 僕のことを,1,1
24883,no! why should i do something like that?,いいえ！なぜ私はそのようなことをする必要がありますか？,0,0
35782,they're well trained for a newly established team. but were unreachable,彼らは新しく設立されたチームのためによく訓練されています。しかし、到達できませんでした,0,0
9045,i'm definitely a libertarian.,僕は自由主義でして,1,1
6161,"kotone, where were you?",コトネ どこ行ってたの?,1,1
24537,that is a night fury.,それは夜の怒りです。,0,0
18976,do you work there?,働いてるの?,1,1
50832,I will not give in to such a threat!,そんな脅しに屈したりは、しない!,0,1
48730,Black Star Did you come properly?,ブラック☆スター あなたは ちゃんと やってきたの?,0,1
41424,It will be a stain later.,後々 染みになったりするからね。,0,1
53090,"Okay, let's train",よし 訓練してやろう 着替えて来い,0,1
49509,Ah! Eh?,あーっ! ええっ?,0,1
2336,i'm very irritated right now.,俺は 今 いらだっている。,1,1
16155,all the information's inside.,記載の住所まで,1,1
27821,with all our resources.,私たちのすべてのリソースで。,0,0
20143,i was sorry and parted. that's right.,申し訳ありませんでしたが、別れました。それは正しい。,0,0
59056,I am working to change that,私はそれを変えるべく活動しています,0,1
45861,I'll talk to her,彼女と話すわ,0,1
43260,It's a substitute for cleansing.,お清めの代わりです いいね,0,1
11919,he wanted you badly.,あんたをとても欲しがってたよ,1,1
11803,"if you don't pee, you can't watch tv, can you?",おしっこしないと テレビ見れないじゃん,1,1
9518,and you destroyed the pillar that was supporting akzeriuth.,そして アクゼリュスを支える柱を消してしまった,1,1
49395,Did we win?,俺達が勝った?,0,1
6949,uh it'sit's in my jacket.,えぇっと それならジャケットに,1,1
47407,"At 13, my father was killed in front of me, and then",13の時、目の前で 父が殺され、その後,0,1
23881,i'm complimenting you! please stop fighting.,私はあなたを褒めています！戦いをやめてください。,0,0
51120,How long ago,どのくらい前の時点で,0,1
43975,This man how far,《この男 どこまで。,0,1
53875,I've been here earlier,先ほどまで いらっしゃったんですが,0,1
12549,"this is just the grassroots stuff again, ok?",これもまた、全くの草の根の運動なのです,1,1
18824,i feel it's not over if i don't that.,そうしないと 何も終わらない気がしてさ。,1,1
